{
  "schema_version": 1,
  "graph_id": "graph_6aa458ee_8d879f",
  "created_at": "2026-09-11T19:39:26+00:00",
  "updated_at": "2026-09-11T21:25:23+00:00",
  "goal": {
    "id": "goal",
    "title": "评估把 `examples/demo-project` 中手写的阻塞式 LLM 调用改造为 Agent 编排的可行性；并在 LangGraph、AutoGen (AG2)、OpenAI Agents SDK、MCP 自建循环四个方案中做出选型",
    "summary": "评估把 `examples/demo-project` 中手写的阻塞式 LLM 调用改造为 Agent 编排的可行性；并在 LangGraph、AutoGen (AG2)、OpenAI Agents SDK、MCP 自建循环四个方案中做出选型",
    "constraints": [
      "只能使用本地 MCP 服务获取外部资料，禁止上传任何源码或数据。",
      "结论必须有可追溯来源与置信度，单个来源不得支撑关键结论。",
      "需给出 6 周内的迁移路线与回滚方案。"
    ]
  },
  "nodes": [
    {
      "id": "c1",
      "type": "claim",
      "title": "AutoGen 不再适合作为新建项目的长期独立选型：微软官方称 Agent Framework 是 AutoGen 与 Semantic Kernel 的直接后继",
      "body": "AutoGen stable 文档仍以独立框架发布（Studio/AgentChat/Core/Extensions），但微软 Agent Framework 概览页写明其为 AutoGen 与 Semantic Kernel 的直接后继并由同一团队创建。两条一手来源并存，说明编排层 API 正在收敛期，独立押注 AutoGen 存在二次迁移风险。",
      "status": "verified",
      "priority": 1,
      "confidence": 1.0,
      "weight": 1.0,
      "iteration": 0,
      "evidence_refs": [
        "ev_6aa46d36_24881d",
        "ev_6aa46d36_b36158",
        "ev_6aa46e42_eb6819",
        "ev_6aa471b9_344a72"
      ],
      "tags": [
        "landscape",
        "framework-churn"
      ],
      "created_by": "analyst",
      "created_at": "2026-09-11T21:05:06+00:00",
      "updated_at": "2026-09-11T21:25:23+00:00"
    },
    {
      "id": "c2",
      "type": "claim",
      "title": "LangGraph 的定位是低层编排运行时，核心价值是 durable execution、持久化 checkpointer、streaming 与 human-in-the-loop",
      "body": "官方概览：LangGraph is a low-level orchestration framework and runtime for building, managing, and deploying long-running, stateful agents；并自述 very low-level, focused entirely on agent orchestration。与本项目需求（可恢复的多步研究循环）高度匹配，代价是需要自行组合 prompt 与 agent 抽象。",
      "status": "verified",
      "priority": 1,
      "confidence": 1.0,
      "weight": 1.0,
      "iteration": 0,
      "evidence_refs": [
        "ev_6aa46d36_41eb66",
        "ev_6aa46e42_e78db7",
        "ev_6aa46e42_333fb9"
      ],
      "tags": [
        "architecture",
        "primary-source"
      ],
      "created_by": "analyst",
      "created_at": "2026-09-11T21:05:06+00:00",
      "updated_at": "2026-09-11T21:25:23+00:00"
    },
    {
      "id": "c3",
      "type": "claim",
      "title": "OpenAI Agents SDK 以少量原语（handoffs / guardrails / sessions）覆盖多 Agent 委派与输入校验，学习成本最低，但缺少图级可恢复执行",
      "body": "官方文档：Sessions 是维持 agent 循环上下文的持久记忆层，Handoffs 用于跨 agent 委派，Guardrails 并行执行输入与安全校验并快速失败。Sessions 提供的是会话记忆而非可回溯的图执行状态，因此在本项目的多阶段验证循环中控制粒度弱于 LangGraph。",
      "status": "supported",
      "priority": 1,
      "confidence": 0.995,
      "weight": 1.0,
      "iteration": 0,
      "evidence_refs": [
        "ev_6aa46d36_976179",
        "ev_6aa46e42_1ffe68",
        "ev_6aa471b9_c0a84c"
      ],
      "tags": [
        "tradeoff",
        "sdk"
      ],
      "created_by": "analyst",
      "created_at": "2026-09-11T21:05:06+00:00",
      "updated_at": "2026-09-11T21:25:23+00:00"
    },
    {
      "id": "c4",
      "type": "claim",
      "title": "官方最佳实践：开放/对话式任务用 agent，步骤确定的流程用 workflow，能用普通函数完成的任务不应引入 agent",
      "body": "微软 Agent Framework 概览给出 agent/workflow 选择判据（task is open-ended or conversational vs process has well-defined steps），并明确 If you can write a function to handle the task, do that instead of using an AI agent。对本项目的直接含义：确定性检索/解析管线不应被 agent 化，agent 只保留在规划与判断节点。",
      "status": "verified",
      "priority": 1,
      "confidence": 1.0,
      "weight": 1.0,
      "iteration": 0,
      "evidence_refs": [
        "ev_6aa46d36_37c989",
        "ev_6aa46d36_f342b9"
      ],
      "tags": [
        "practice",
        "scope-control"
      ],
      "created_by": "analyst",
      "created_at": "2026-09-11T21:05:06+00:00",
      "updated_at": "2026-09-11T21:25:23+00:00"
    },
    {
      "id": "c5",
      "type": "claim",
      "title": "MCP 只定义工具/资源访问与信任模型，不提供编排循环；自建循环必须自行承担用户同意、权限控制与审计",
      "body": "MCP 2025-06-18 规范 Trust & Safety：协议通过任意数据访问与代码执行路径带来能力，也随之带来必须由实现者处理的安全与信任问题；关键原则要求用户明确同意并保留对数据共享与操作的控制。因此 MCP-only 方案的隐性工程量是循环控制器、检查点与审计日志。",
      "status": "verified",
      "priority": 1,
      "confidence": 1.0,
      "weight": 1.0,
      "iteration": 0,
      "evidence_refs": [
        "ev_6aa46d36_c0fd19",
        "ev_6aa46d36_b47b1d",
        "ev_6aa471b9_3f494d"
      ],
      "tags": [
        "mcp",
        "security"
      ],
      "created_by": "analyst",
      "created_at": "2026-09-11T21:05:06+00:00",
      "updated_at": "2026-09-11T21:25:23+00:00"
    },
    {
      "id": "c6",
      "type": "claim",
      "title": "代码事实：demo-project 的 LLM 路径是阻塞式单发调用，ADR-001 已自述代价为无重试、无流式、无工具、无可观测性",
      "body": "src/summariser.py 用 urllib 直连 chat/completions，TIMEOUT_SECONDS=30，无异常处理；docs/DECISIONS.md 的 ADR-001（accepted, under review）明确列出上述代价并把『LangGraph 还是 AutoGen，还是继续手写』记为 open question。本 claim 只陈述工作区事实，收益量级见 g-benchmark-missing 与 c7。",
      "status": "verified",
      "priority": 1,
      "confidence": 1.0,
      "weight": 1.0,
      "iteration": 0,
      "evidence_refs": [
        "ev_6aa46d36_41eb66",
        "ev_6aa46d36_2d2951",
        "ev_6aa46e42_333fb9",
        "ev_6aa46e42_d009de",
        "ev_6aa46e42_d4fba2"
      ],
      "tags": [
        "workspace",
        "code-grounding"
      ],
      "created_by": "analyst",
      "created_at": "2026-09-11T21:05:06+00:00",
      "updated_at": "2026-09-11T21:25:23+00:00"
    },
    {
      "id": "c7",
      "type": "claim",
      "title": "推断：厂商正在把 planner/harness 能力内置（Agent Framework 的 Harness Agent、LangGraph 的部署平台），本 Skill 自研 planner 层存在被官方实现吸收的风险，选型必须保留替换空间",
      "body": "依据是两处厂商自述的能力清单扩张，属于趋势推断而非既有事实：Agent Framework 概览把 Harness Agent 描述为自带 planning 与 todo 跟踪、上下文压缩、文件访问与记忆、don't-ask-again 工具审批与可观测性的 opinionated agent；LangGraph 概览把 deployment 平台与跨团队 agent 复用列为生态能力。若这些抽象成熟，NexusSearch 的 planner 可能只需保留策略配置而非实现。置信度不足 0.7，标记 uncertain，需要在下一轮研究中找一手反例或采用证据。",
      "status": "proposed",
      "priority": 1,
      "confidence": 0.37,
      "weight": 1.0,
      "iteration": 0,
      "evidence_refs": [
        "ev_6aa46e42_267671",
        "ev_6aa46e42_d5ede6"
      ],
      "tags": [
        "uncertain",
        "forecast",
        "needs-counterexample"
      ],
      "created_by": "analyst",
      "created_at": "2026-09-11T21:09:49+00:00",
      "updated_at": "2026-09-11T21:25:23+00:00"
    },
    {
      "id": "c8",
      "type": "claim",
      "title": "流式与失败重试在四个方案中的承担者不同：LangGraph 用 durable execution + streaming，Agent Framework 用 graph-based workflow 提供显式执行路径，Agents SDK 用 guardrails 快速失败 + human-in-the-loop，MCP 只定义传输与信任模型、重试属实现者责任",
      "body": "三个框架各自有一手文本说明其承担方式；MCP 侧的判据来自反向证据：本项目 runtime/mcp_router.py 自行实现 timeout/retry/fallback/audit，说明协议层不提供这些语义，选型比较的是『谁替你实现』而不是『有没有』。",
      "status": "supported",
      "priority": 1,
      "confidence": 1.0,
      "weight": 1.0,
      "iteration": 0,
      "evidence_refs": [
        "ev_6aa471b9_b91061",
        "ev_6aa471b9_344a72",
        "ev_6aa471b9_c0a84c",
        "ev_6aa471b9_3f494d"
      ],
      "tags": [
        "streaming",
        "retry",
        "comparison"
      ],
      "created_by": "analyst",
      "created_at": "2026-09-11T21:24:33+00:00",
      "updated_at": "2026-09-11T21:25:23+00:00"
    },
    {
      "id": "c9",
      "type": "claim",
      "title": "迁移的运维成本增量主要在持久化后端与观测：LangGraph 把调试/观测指向 LangSmith 平台，AutoGen 用 Studio 降低原型成本，而本项目已具备本地 tool-calls 审计与 loop.jsonl，可不自建云端观测",
      "body": "观测与部署是厂商生态位而非框架内建：LangGraph README 将 Debugging 指向 LangSmith、并引入独立 deployment platform；AutoGen 的 Studio 是无代码原型入口（pip install -U autogenstudio）。本仓库已把 MCP 调用与循环迭代写为 JSONL 审计，因此 q3 的『运维成本』主要落在 checkpointer 后端选型，而不是从零建观测。",
      "status": "supported",
      "priority": 1,
      "confidence": 0.878,
      "weight": 1.0,
      "iteration": 0,
      "evidence_refs": [
        "ev_6aa471b9_fceed9",
        "ev_6aa471b9_0be8cf"
      ],
      "tags": [
        "cost",
        "observability",
        "ops"
      ],
      "created_by": "analyst",
      "created_at": "2026-09-11T21:24:33+00:00",
      "updated_at": "2026-09-11T21:25:23+00:00"
    },
    {
      "id": "con-只能使用本地-mcp-服务获取外部资料-禁止上传",
      "type": "constraint",
      "title": "只能使用本地 MCP 服务获取外部资料，禁止上传任何源码或数据。",
      "priority": 1,
      "confidence": 0.0,
      "weight": 1.0,
      "iteration": 0,
      "created_by": "planner",
      "created_at": "2026-09-11T19:39:26+00:00",
      "updated_at": "2026-09-11T19:39:26+00:00"
    },
    {
      "id": "con-结论必须有可追溯来源与置信度-单个来源不得支撑关",
      "type": "constraint",
      "title": "结论必须有可追溯来源与置信度，单个来源不得支撑关键结论。",
      "priority": 1,
      "confidence": 0.0,
      "weight": 1.0,
      "iteration": 0,
      "created_by": "planner",
      "created_at": "2026-09-11T19:39:26+00:00",
      "updated_at": "2026-09-11T19:39:26+00:00"
    },
    {
      "id": "con-需给出-6-周内的迁移路线与回滚方案",
      "type": "constraint",
      "title": "需给出 6 周内的迁移路线与回滚方案。",
      "priority": 1,
      "confidence": 0.0,
      "weight": 1.0,
      "iteration": 0,
      "created_by": "planner",
      "created_at": "2026-09-11T19:39:26+00:00",
      "updated_at": "2026-09-11T19:39:26+00:00"
    },
    {
      "id": "d1",
      "type": "decision",
      "title": "选型：以 LangGraph 图编排为控制面 + 本地 MCP servers 为工具面，AutoGen / Agents SDK / MCP 自建循环均不采用",
      "body": "在满足 PRP 约束（本地优先、无云依赖、可验证证据链）前提下，LangGraph 提供与需求最匹配的状态持久化与可恢复执行；工具调用继续走本地 MCP 路由器，保留超时/重试/降级/审计。",
      "priority": 1,
      "confidence": 0.0,
      "weight": 1.0,
      "iteration": 0,
      "evidence_refs": [
        "ev_6aa46d36_41eb66",
        "ev_6aa46d36_c0fd19",
        "ev_6aa46d36_b47b1d",
        "ev_6aa46e42_e78db7",
        "ev_6aa46e42_333fb9",
        "ev_6aa46e42_d009de"
      ],
      "decision": {
        "choice": "LangGraph 图编排（本地 checkpointer）+ 本地 MCP 工具层",
        "alternatives": [
          "AutoGen / AG2",
          "OpenAI Agents SDK",
          "MCP 自建 while 循环"
        ],